{
  "contract_id": "zouroboros-authority-envelope/v1",
  "schema_version": 1,
  "envelope_id": "ae-01J0000000000000000000000A",
  "principal": { "kind": "operator", "id": "fixture-operator" },
  "capabilities": [
    {
      "capability": "factory.contract-test",
      "resources": [
        "Projects/zouroboros-software-factory/fixtures/authority-envelope/*",
        "Projects/zouroboros-software-factory/contracts/authority-envelope-v1.schema.json"
      ],
      "argument_constraints": {
        "mode": { "enum": ["read"] }
      },
      "credential_classes": ["fixture-local"],
      "revoked_at": null
    }
  ],
  "validity": {
    "not_before": "2026-01-01T00:00:00Z",
    "expires_at": "2026-12-31T23:59:59Z"
  },
  "environment": {
    "runtime_root": "fixture-root",
    "isolation_mode": "isolated-worktree",
    "repository": "marlandoj/zouroboros",
    "state_dir": "fixture-state"
  },
  "approval_binding": {
    "actor": "fixture-operator",
    "session_id": "fixture-session",
    "run_id": "fixture-run",
    "tool": "authority-envelope-check",
    "bound_arguments_sha256": "e4c382018ca76d5da417e38889c611ef785a14cde816269c6b6cc06d966717b5",
    "lifetime": { "kind": "run" },
    "required_terminal_outcome": null
  },
  "global_rung_cap": "open-pr",
  "delegation": { "parent_envelope_ref": null, "depth": 0 },
  "integration_refs": {
    "permission_rung_ref": "fixture:global-rung.json",
    "skillspector_finding_refs": ["skillspector:fixture-finding-1"],
    "mcp_finding_refs": ["mcp-inject-scan:fixture-finding-1"],
    "provenance_evidence_refs": ["provenance:fixture-chain-1"]
  },
  "enforcement_evidence": {
    "kind": "fixture",
    "evidence_ref": "fixtures/authority-envelope/evidence-v1",
    "sha256": "78ab22b0afd5f1359c11d0b5d74be2a0555a55a7af2ff9fdc10bd02a6990403c"
  }
}
